{
  "proposal_version": "1",
  "proposal_id": "018f4f7e-10bd-7d98-9b23-9ec89a1d9c3d",
  "proposed_by": "agent:syntropic-agent",
  "created_at": "2026-10-23T12:00:00Z",
  "execution_request": {
    "protocol_version": "1",
    "request_id": "018f4f7e-10bd-7d98-9b23-9ec89a1d9c3a",
    "project_id": "018f4f7e-10bd-7d98-9b23-9ec89a1d9c3b",
    "chain_namespace": "eip155",
    "chain_id": "84532",
    "operation": "deploy_project_component",
    "target": "0x1234567890abcdef1234567890abcdef12345678",
    "value_base_units": "0",
    "gas_limit": "120000",
    "calldata_hash": "0x56570de287d73cd1cb6092bb8fdee6173974955fdef345ae579ee9f475ea7432",
    "signing_payload_hash": "0x11a53647e6d74bf0a382e9fedc868e4cffa55ee67a93c59d6dd345a0a70a568f",
    "signer_key_version": 0,
    "expected_effect_hash": "0x25028eb0c5c97e0251badc598ae0573057547611b5e9c7e355cf2b0f2576ad23",
    "nonce": "0",
    "gas_policy": {
      "max_fee": "1000000000",
      "max_priority_fee": "1000000"
    },
    "expires_at": "2035-01-01T00:00:00Z",
    "policy_version": "policy-v1",
    "idempotency_key": "deploy-project-001"
  },
  "rationale": "Example only: request independent human review before any policy approval or execution."
}
